<?xml version="1.0" encoding="utf-8" standalone="yes" ?>
<people xmlns:xsi="http://www.w3.org/2001/XMLSchema-instance"
 xsi:noNamespaceSchemaLocation="people.xsd"><!-- xsi: xml schema instance -->
  <person position="PHP Developer">
    <name><!--this is a comment-->
		  <first>John</first>
		  <last>Doe</last>
		</name>
  </person>
  <person position="Wizard">
    <name>
		  <first attr="test">Hermione</first>
		  <last>Granger</last>
		</name>
		<bio>
			Harry Potter is a <magic>mixed content</magic>.
		</bio>
  </person>
</people>